{
  "evidence_id": "ev-rg-0002-001",
  "evidence_type": "policy_reference",
  "question_ref": "q-rg-0002",
  "target_claim_ref": "gap-claim-rg-0002",
  "representation_ref": "declared.md",
  "source": {
    "source_type": "document",
    "source_ref": "declared.md",
    "source_owner": "repository_governance"
  },
  "provenance_refs": [
    "prov-declared-rg-0002"
  ],
  "relevance": {
    "value": "strongly_relevant",
    "basis": "The declared state explicitly requires pull request review before protected application code is merged to main."
  },
  "reliability": {
    "value": "moderate",
    "basis": "The document is treated as the benchmark's declared source of truth for the case."
  },
  "direction": "supports",
  "confidence_impact": {
    "impact_direction": "increase",
    "impact_magnitude": "high",
    "basis": "Directly establishes the declared peer review process constraint."
  },
  "timestamp": "2026-06-21T14:00:00-04:00",
  "scope": "protected_application_code",
  "limitations": [
    "Benchmark case source, not an external audited policy."
  ]
}